{
  "schemaVersion": 1,
  "releaseId": "2026.7.1-2+nas.3",
  "status": "blocked",
  "blockingIssues": [
    "The hosted image installed only the OpenClaw host tarball. It did not install the separately qualified Codex plugin artifact, while restored state intentionally excludes nested plugin node_modules. The never-activated image cannot satisfy the external-plugin runtime acceptance gate; replace it immutably rather than mutating its tag."
  ],
  "npm": {
    "version": "2026.7.1-2",
    "distTag": "latest",
    "integrity": "sha512-ycF3yPcbjN6bUPeaUx6Mh6vze1hQWoD3CT/wWcmD7a8xaHHHRUaAlaq+lFxMHf1ssEgODVAwjlzYqp2twkYZ7g==",
    "tarball": "https://registry.npmjs.org/openclaw/-/openclaw-2026.7.1-2.tgz"
  },
  "source": {
    "ref": "refs/heads/release/2026.7.1",
    "baseCommit": "0790d9f593ad30c940ed93b5872a8cf6d6f3cf8c",
    "commit": "bbb31b41a5c0771d2eb2b8e272eed14ea5e3f890",
    "stableDivergence": { "ahead": 8, "behind": 0 },
    "mainDivergence": { "ahead": 232, "behind": 5319 }
  },
  "node": {
    "buildVersion": "22.23.1",
    "engine": ">=22.22.3 <23 || >=24.15.0 <25 || >=25.9.0"
  },
  "externalPlugins": [
    {
      "id": "codex",
      "package": "@openclaw/codex",
      "version": "2026.7.1-1",
      "integrity": "sha512-fRQITjqjC4Q/M6WmkR9XPWPuL+7vcvyVUWIDztB08X2G/mhzSwCYwQp4hugxAtuKmO3yx/7ULMK3nyeKsg5zGw==",
      "tarball": "https://registry.npmjs.org/@openclaw/codex/-/codex-2026.7.1-1.tgz",
      "artifact": {
        "filename": "openclaw-codex-2026.7.1-1-nas.3.tgz",
        "url": "https://github.com/AshleyHollis/openclaw/releases/download/nas-v2026.7.1-2.3/openclaw-codex-2026.7.1-1-nas.3.tgz",
        "sha256": "9336e6e0ad7697a94257253665b0f4e7fcfdc2af567610a549ace519d442b94b"
      }
    }
  ],
  "patches": [
    {
      "id": "qmd-gpu-off",
      "file": "downstream/patches/2026.7.1-2/0001-fix-memory-disable-QMD-GPU-acceleration-by-default.patch",
      "sha256": "22d17b6d1585d5241d38560e6b4f455468ae5b21fe20a007e05cd7b94c8029f9",
      "status": "required",
      "tests": ["extensions/memory-core/src/memory/qmd-manager.test.ts"]
    },
    {
      "id": "discord-package-runtime",
      "file": "downstream/patches/2026.7.1-2/0002-fix-package-include-Discord-runtime-in-distribution.patch",
      "sha256": "202beb8cb9d71660d7f570d702bbede5a470953bdc0928d3114fe0387d1fd5d3",
      "status": "required",
      "tests": ["node scripts/check-openclaw-package-tarball.mjs"]
    },
    {
      "id": "discord-runtime-dependencies",
      "file": "downstream/patches/2026.7.1-2/0003-fix-discord-pin-required-voice-runtime-dependencies.patch",
      "sha256": "6115babd78206c44ecd30b3d42e1c1714e5643891913bf10d98dee60e1eeb364",
      "status": "required",
      "tests": ["pnpm deps:shrinkwrap:check", "node scripts/check-openclaw-package-tarball.mjs"]
    },
    {
      "id": "suppress-jsonl-fallback",
      "file": "downstream/patches/2026.7.1-2/0004-fix-agents-suppress-raw-JSONL-fallback-output.patch",
      "sha256": "4ab935c69104a2362edabc2eff17f04613bfd4560c5081ea7af7dc68c9df587b",
      "status": "required",
      "tests": ["src/agents/cli-output.test.ts"]
    },
    {
      "id": "invalid-thinking-session-expired",
      "file": "downstream/patches/2026.7.1-2/0005-fix-agents-expire-invalid-thinking-signature-session.patch",
      "sha256": "47a9f96c84e5713df600ac39f23a1a169453278b0fd805bb8e2b7826e71bfe36",
      "status": "required",
      "tests": ["src/agents/embedded-agent-helpers.isbillingerrormessage.test.ts"]
    },
    {
      "id": "channels-status-cli-identity",
      "file": "downstream/patches/2026.7.1-2/0006-fix-channels-use-CLI-identity-for-status-RPC.patch",
      "sha256": "abe6078c4ab0825fa9f2b616954e6bf0ec3e4f5bea3ea980074b0aad93114ca2",
      "status": "required",
      "tests": ["src/commands/channels/status.test.ts"]
    },
    {
      "id": "codex-lazy-plugin-state",
      "file": "downstream/patches/2026.7.1-2/0007-fix-codex-defer-plugin-state-until-runtime-use.patch",
      "sha256": "11d5df26868aab81356919cff284cbd177d2d7508fea12711ec8706a1b3ca706",
      "status": "required",
      "tests": ["extensions/codex/index.test.ts", "downstream/scripts/smoke-external-plugin.sh"]
    },
    {
      "id": "shrinkwrap-dependency-forks",
      "file": "downstream/patches/2026.7.1-2/0008-fix-deps-restore-shrinkwrap-dependency-forks.patch",
      "sha256": "edc91e3879f2c7f399b90a09432bba4614a482ae12137e558c9ccb5c1b0b6900",
      "status": "required",
      "tests": ["test/scripts/generate-npm-shrinkwrap.test.ts", "pnpm deps:shrinkwrap:check"]
    }
  ],
  "artifact": {
    "filename": "openclaw-2026.7.1-2-nas.3.tgz",
    "url": "https://github.com/AshleyHollis/openclaw/releases/download/nas-v2026.7.1-2.3/openclaw-2026.7.1-2-nas.3.tgz",
    "sha256": "4707cb8da3c381fb951b08c0b2ef5e42b053ce4ce83bfb05e07b8591556b0187",
    "validation": {
      "fullBuild": true,
      "focusedAssertions": 404,
      "packageSmoke": true,
      "externalPluginRegistration": true,
      "scopedLoopbackRpc": true,
      "dependencyMetadataCheck": true,
      "discordRuntimeFiles": 61,
      "patchTests": true,
      "imageSmoke": true,
      "imageScan": true
    }
  },
  "image": {
    "repository": "ghcr.io/ashleyhollis/openclaw",
    "tag": "nas-2026.7.1-2-nas.3",
    "digest": "sha256:40977888b0a1d6d5f3b3ef441527997942d17d2d670b4ef9df6cf6949f96520e",
    "attestationDigest": "sha256:99975fa569767052fd0857af7d0bf53799b4885f2c2fd9eb2ac5d73302ed8358",
    "sbomDigest": "sha256:9cff76b8dd84515f32d101063c9cb537fedcef3520d6858f0c85711a49ae6633",
    "provenanceDigest": "sha256:dfe3cf483384a3f4b21aa55740ca700cedcc82e0a31c92fb76e233eb96dfc440"
  },
  "testResults": {
    "downstreamGuard": "https://github.com/AshleyHollis/openclaw/actions/runs/29668651488",
    "dryRun": "https://github.com/AshleyHollis/openclaw/actions/runs/29669923322",
    "publish": "https://github.com/AshleyHollis/openclaw/actions/runs/29670093497"
  }
}
