{
  "schemaVersion": 1,
  "releaseId": "2026.7.1-2+nas.1",
  "status": "blocked",
  "blockingIssues": [
    "The exact artifact fails Codex CLI-metadata registration because @openclaw/codex opens plugin state against the base registration runtime.",
    "The original qualification did not exercise external-plugin registration or a scoped loopback gateway RPC."
  ],
  "npm": {
    "version": "2026.7.1-2",
    "distTag": "latest",
    "integrity": "sha512-ycF3yPcbjN6bUPeaUx6Mh6vze1hQWoD3CT/wWcmD7a8xaHHHRUaAlaq+lFxMHf1ssEgODVAwjlzYqp2twkYZ7g==",
    "tarball": "https://registry.npmjs.org/openclaw/-/openclaw-2026.7.1-2.tgz"
  },
  "source": {
    "ref": "refs/heads/release/2026.7.1",
    "baseCommit": "0790d9f593ad30c940ed93b5872a8cf6d6f3cf8c",
    "commit": "7371082dbe4dbcaa06685f7960c95d234ce1fb4a",
    "stableDivergence": { "ahead": 1, "behind": 0 },
    "mainDivergence": { "ahead": 2, "behind": 43 }
  },
  "node": {
    "buildVersion": "22.23.1",
    "engine": ">=22.22.3 <23 || >=24.15.0 <25 || >=25.9.0"
  },
  "externalPlugins": [
    {
      "id": "codex",
      "package": "@openclaw/codex",
      "version": "2026.7.1-1",
      "integrity": "sha512-fRQITjqjC4Q/M6WmkR9XPWPuL+7vcvyVUWIDztB08X2G/mhzSwCYwQp4hugxAtuKmO3yx/7ULMK3nyeKsg5zGw==",
      "tarball": "https://registry.npmjs.org/@openclaw/codex/-/codex-2026.7.1-1.tgz",
      "artifact": null
    }
  ],
  "patches": [
    {
      "id": "qmd-gpu-off",
      "file": "downstream/patches/2026.7.1-2/0001-fix-memory-disable-QMD-GPU-acceleration-by-default.patch",
      "sha256": "22d17b6d1585d5241d38560e6b4f455468ae5b21fe20a007e05cd7b94c8029f9",
      "status": "required",
      "tests": ["extensions/memory-core/src/memory/qmd-manager.test.ts"]
    },
    {
      "id": "discord-package-runtime",
      "file": "downstream/patches/2026.7.1-2/0002-fix-package-include-Discord-runtime-in-distribution.patch",
      "sha256": "202beb8cb9d71660d7f570d702bbede5a470953bdc0928d3114fe0387d1fd5d3",
      "status": "required",
      "tests": ["node scripts/check-openclaw-package-tarball.mjs"]
    },
    {
      "id": "discord-runtime-dependencies",
      "file": "downstream/patches/2026.7.1-2/0003-fix-discord-pin-required-voice-runtime-dependencies.patch",
      "sha256": "6115babd78206c44ecd30b3d42e1c1714e5643891913bf10d98dee60e1eeb364",
      "status": "required",
      "tests": ["pnpm deps:shrinkwrap:check", "node scripts/check-openclaw-package-tarball.mjs"]
    },
    {
      "id": "suppress-jsonl-fallback",
      "file": "downstream/patches/2026.7.1-2/0004-fix-agents-suppress-raw-JSONL-fallback-output.patch",
      "sha256": "4ab935c69104a2362edabc2eff17f04613bfd4560c5081ea7af7dc68c9df587b",
      "status": "required",
      "tests": ["src/agents/cli-output.test.ts"]
    },
    {
      "id": "invalid-thinking-session-expired",
      "file": "downstream/patches/2026.7.1-2/0005-fix-agents-expire-invalid-thinking-signature-session.patch",
      "sha256": "47a9f96c84e5713df600ac39f23a1a169453278b0fd805bb8e2b7826e71bfe36",
      "status": "required",
      "tests": ["src/agents/embedded-agent-helpers.isbillingerrormessage.test.ts"]
    },
    {
      "id": "channels-status-cli-identity",
      "file": "downstream/patches/2026.7.1-2/0006-fix-channels-use-CLI-identity-for-status-RPC.patch",
      "sha256": "abe6078c4ab0825fa9f2b616954e6bf0ec3e4f5bea3ea980074b0aad93114ca2",
      "status": "required",
      "tests": ["src/commands/channels/status.test.ts"]
    }
  ],
  "artifact": {
    "filename": "openclaw-2026.7.1-2.tgz",
    "url": "https://github.com/AshleyHollis/openclaw/releases/download/nas-v2026.7.1-2.1/openclaw-2026.7.1-2.tgz",
    "sha256": "f009fb7f3d0869084c7da9c5044850aa15dd233ce8ee24272a0dcd1da23022d6",
    "validation": {
      "fullBuild": true,
      "focusedAssertions": 888,
      "packageSmoke": true,
      "externalPluginRegistration": false,
      "scopedLoopbackRpc": false,
      "dependencyMetadataCheck": true,
      "discordRuntimeFiles": 61,
      "patchTests": true,
      "imageSmoke": true,
      "imageScan": true
    }
  },
  "image": {
    "repository": "ghcr.io/ashleyhollis/openclaw",
    "tag": "nas-2026.7.1-2-nas.1",
    "digest": "sha256:4681868fceb01c44f3d076d6b185a7e83373044f872b14c6ff100c8532e995a4",
    "attestationDigest": "sha256:40a98490bbf0c23d72adbbabad160542b367f073404ca04076d09a918f49612b",
    "sbomDigest": "sha256:6e86d2f7b8e6bdd1a9b7f549768d5b93dc466337c17591ca467dc387dceff70e",
    "provenanceDigest": "sha256:e5c7566c31e855f84e824a0c4b2b777d8a561555f14c79c7f72cf68912191492"
  },
  "testResults": {
    "downstreamGuard": "https://github.com/AshleyHollis/openclaw/actions/runs/29635441629",
    "dryRun": "https://github.com/AshleyHollis/openclaw/actions/runs/29636037605",
    "publish": "https://github.com/AshleyHollis/openclaw/actions/runs/29636176082"
  }
}
